{
  "loadId": "6f1c0a2e-7b14-4d2a-9c31-0a6e5d8b41f2",
  "sourceCode": "wall-material",
  "sourceFile": "dWall_v02.xsd",
  "part": 1,
  "last": true,
  "tables": [
    {
      "name": "wall_material",
      "rows": [
        { "value_code": "061001001000", "name": "каменные", "parent_code": null },
        { "value_code": "061001001001", "name": "кирпичные", "parent_code": "061001001000" }
      ]
    }
  ]
}
